{"$schema":"https://json-schema.org/draft/2020-12/schema",
 "description":"EX-1: the per-project third-party lock <project>/benchmarks/project/third_party/lock.json. It pins the project's own Python wheels (they enter the project bench image under /opt/project-python) and source archives (review material; they never enter an image). Each item binds its parts, provenance record, notice and license record by sha256. bench.json binds this file by sha256 (bench_model.project_bench). Every path is relative to benchmarks/project/ and lies under third_party/. A change needs the approver (safety/protected-paths.json project_protected). FW-HOOK (fact F14): additive forms. A retained row binds upstream files kept without their archive (for example selected headers of a source release); files of a wheel or source row binds more upstream files of that row; a provenance or notice record may bind its size. The privacy hook (.githooks/personal_info_check.py) exempts the content of a file only when this lock of the same revision binds its exact path, sha256 and size in a row whose origin URL matches $defs.exempt_origin_url (a wheel part only under third_party/wheels/ in a PyPI wheel row); no row binds this lock itself. T6-R2: a wheel row of tracked parts may declare host_members, its few members above the container file bound (at most 4, each at most 50331648 bytes); the host writes them into the image layer from the verified wheel bytes. T6-R3: a wheel row may declare notice_member, the exact wheel member path of its license file.",
 "type":"object","additionalProperties":false,"required":["schema_version","owner","sanitizer_boundary","wheels","sources"],
 "properties":{
  "schema_version":{"const":1},
  "owner":{"type":"string","minLength":1,"maxLength":120},
  "sanitizer_boundary":{"type":"string","minLength":1,"maxLength":400},
  "wheels":{"type":"array","maxItems":16,"items":{"$ref":"#/$defs/wheel"}},
  "sources":{"type":"array","maxItems":16,"items":{"$ref":"#/$defs/source"}},
  "retained":{"type":"array","maxItems":16,"items":{"$ref":"#/$defs/retained"}}},
 "$defs":{
  "sha256":{"type":"string","pattern":"^[0-9a-f]{64}$"},
  "path":{"type":"string","maxLength":200,"pattern":"^third_party/[A-Za-z0-9_][A-Za-z0-9._+-]*(?:/[A-Za-z0-9_][A-Za-z0-9._+-]*)*$"},
  "file":{"type":"object","additionalProperties":false,"required":["path","sha256"],
   "properties":{"path":{"$ref":"#/$defs/path"},"sha256":{"$ref":"#/$defs/sha256"},
    "bytes":{"type":"integer","minimum":1,"maximum":1048576,"description":"FW-HOOK: the record size; the privacy hook exempts a provenance or notice record only with its size"}}},
  "part":{"type":"object","additionalProperties":false,"required":["path","sha256","bytes"],
   "properties":{"path":{"$ref":"#/$defs/path"},"sha256":{"$ref":"#/$defs/sha256"},"bytes":{"type":"integer","minimum":1,"maximum":33554432}}},
  "origin":{"oneOf":[
   {"type":"object","additionalProperties":false,"required":["kind","url"],"description":"EX1-A01: only in a framework fixture project under tests/fixtures/ (tools/project_third_party.py check_lock)","properties":{"kind":{"const":"first-party-fixture"},"url":{"type":"null"}}},
   {"type":"object","additionalProperties":false,"required":["kind","url"],"properties":{"kind":{"const":"pypi"},"url":{"type":"string","maxLength":400,"pattern":"^https://files\\.pythonhosted\\.org/[A-Za-z0-9._/+%-]+$"}}},
   {"type":"object","additionalProperties":false,"required":["kind","url"],"properties":{"kind":{"const":"upstream-archive"},"url":{"type":"string","maxLength":400,"pattern":"^https://[A-Za-z0-9.-]+/[A-Za-z0-9._/+%~-]+$"}}}]},
  "license":{"type":"object","additionalProperties":false,"required":["tags","owner","review_status"],
   "properties":{"tags":{"type":"array","minItems":1,"maxItems":16,"uniqueItems":true,
     "items":{"enum":["MIT","BSD-2-Clause","BSD-3-Clause","Apache-2.0","BSL-1.0","PSF-2.0","ISC","Zlib","0BSD",
                      "LGPL-2.1-or-later","GPL-3.0-or-later WITH GCC-exception-3.1"]}},
    "owner":{"type":"string","minLength":1,"maxLength":120},
    "review_status":{"enum":["PENDING","APPROVED"]}}},
  "name":{"type":"string","pattern":"^[A-Za-z0-9][A-Za-z0-9._-]{0,62}$"},
  "version":{"type":"string","pattern":"^[0-9][A-Za-z0-9.+!-]{0,40}$"},
  "wheel":{"type":"object","additionalProperties":false,
   "required":["name","version","filename","tag","modules","sha256","bytes","parts","origin","provenance","notice","license"],
   "properties":{"name":{"$ref":"#/$defs/name"},"version":{"$ref":"#/$defs/version"},
    "filename":{"type":"string","maxLength":160,"pattern":"^[A-Za-z0-9_.+-]+\\.whl$"},
    "tag":{"type":"string","maxLength":120,"pattern":"^[a-z0-9_.]+-[a-z0-9_.]+-[a-z0-9_.]+$"},
    "modules":{"type":"array","minItems":1,"maxItems":8,"uniqueItems":true,"items":{"type":"string","pattern":"^[A-Za-z_][A-Za-z0-9_]{0,62}$"}},
    "sha256":{"$ref":"#/$defs/sha256"},"bytes":{"type":"integer","minimum":1,"maximum":67108864},
    "parts":{"type":"array","minItems":0,"maxItems":2,"items":{"$ref":"#/$defs/part"}},
    "source_dir":{"$ref":"#/$defs/path","description":"first-party fixture wheels only: the tracked source directory that project_third_party.build_source_wheel turns into the wheel bytes (parts is then empty)"},
    "files":{"$ref":"#/$defs/files"},
    "notice_member":{"type":"string","maxLength":200,"pattern":"^[A-Za-z0-9_][A-Za-z0-9._+-]*(?:/[A-Za-z0-9_][A-Za-z0-9._+-]*)*$",
     "description":"T6-R3: the exact wheel member path of the license file, below the dist-info directory or below <dist>.data/data/ (tools/project_third_party.py notice_member_rules). The extraction job reads exactly that member (at most 1048576 bytes) as the notice; without it the job searches the dist-info directory"},
    "host_members":{"type":"array","minItems":1,"maxItems":4,"items":{"$ref":"#/$defs/host_member"},
     "description":"T6-R2: the members of this wheel above the container file bound (33554432 bytes), each with its exact size and sha256. The extraction job hashes each one in bounded chunks and never writes it; the host streams it from the verified wheel bytes into the layer. A wheel of tracked parts only (tools/project_third_party.py HOST_MEMBERS_MAX)"},
    "origin":{"$ref":"#/$defs/origin"},"provenance":{"$ref":"#/$defs/file"},"notice":{"$ref":"#/$defs/file"},"license":{"$ref":"#/$defs/license"}}},
  "source":{"type":"object","additionalProperties":false,
   "required":["name","version","filename","sha256","bytes","parts","origin","provenance","notice","license"],
   "properties":{"name":{"$ref":"#/$defs/name"},"version":{"$ref":"#/$defs/version"},
    "filename":{"type":"string","maxLength":160,"pattern":"^[A-Za-z0-9_.+-]+$"},
    "sha256":{"$ref":"#/$defs/sha256"},"bytes":{"type":"integer","minimum":1,"maximum":67108864},
    "parts":{"type":"array","minItems":1,"maxItems":2,"items":{"$ref":"#/$defs/part"}},
    "files":{"$ref":"#/$defs/files"},
    "origin":{"$ref":"#/$defs/origin"},"provenance":{"$ref":"#/$defs/file"},"notice":{"$ref":"#/$defs/file"},"license":{"$ref":"#/$defs/license"}}},
  "host_member":{"type":"object","additionalProperties":false,"required":["member","bytes","sha256"],
   "description":"T6-R2: one host member: its path inside the wheel (not a repository path), its size above the container file bound and at most the host member bound (tools/project_third_party.py HOST_MEMBER_MAX_BYTES), and its sha256",
   "properties":{"member":{"type":"string","maxLength":200,"pattern":"^[A-Za-z0-9_][A-Za-z0-9._+-]*(?:/[A-Za-z0-9_][A-Za-z0-9._+-]*)*$"},
    "bytes":{"type":"integer","minimum":33554433,"maximum":50331648},"sha256":{"$ref":"#/$defs/sha256"}}},
  "files":{"type":"array","maxItems":256,"items":{"$ref":"#/$defs/part"},"description":"FW-HOOK: more upstream files of a row (for example license texts), each bound by path, sha256 and bytes"},
  "retained":{"type":"object","additionalProperties":false,"required":["name","version","files","origin","provenance","notice","license"],
   "description":"FW-HOOK: upstream files kept without their upstream archive (the provenance record names the archive and its digest); they never enter an image",
   "properties":{"name":{"$ref":"#/$defs/name"},"version":{"$ref":"#/$defs/version"},
    "files":{"type":"array","minItems":1,"maxItems":256,"items":{"$ref":"#/$defs/part"}},
    "origin":{"$ref":"#/$defs/origin"},"provenance":{"$ref":"#/$defs/file"},"notice":{"$ref":"#/$defs/file"},"license":{"$ref":"#/$defs/license"}}},
  "exempt_origin_url":{"type":"string","maxLength":400,
   "pattern":"^https://(?!.*\\.\\.)(?:files\\.pythonhosted\\.org/[A-Za-z0-9._/+%-]+|github\\.com/[A-Za-z0-9_-][A-Za-z0-9_.-]*/[A-Za-z0-9_-][A-Za-z0-9_.-]*/(?:releases/download|archive)/[A-Za-z0-9._/+%~-]+|archives\\.boost\\.io/release/[A-Za-z0-9._/+%~-]+)$",
   "description":"FW-HOOK: the upstream allowlist of the privacy hook (UPSTREAM_URL in .githooks/personal_info_check.py; a unit test keeps both equal): PyPI files, GitHub release downloads and archives, Boost release archives. An origin URL outside it is valid in the lock, but the hook exempts no file of that row."}}}
