{
 "schema_version": 1,
 "owner": "MarketData-App",
 "sanitizer_boundary": "QuantLib and SciPy hold native code (extension modules, bundled libraries; the extraction job lists them in elf_files). It runs only in bench containers in the project bench image and is never linked into first-party C, so sanitizer qualification does not apply (EX1-A02). mpmath is pure Python. The source archive and the Boost files are review material only.",
 "wheels": [
  {
   "name": "quantlib",
   "version": "1.43",
   "filename": "quantlib-1.43-cp39-abi3-manylinux_2_24_x86_64.manylinux_2_28_x86_64.whl",
   "tag": "cp39-abi3-manylinux_2_24_x86_64.manylinux_2_28_x86_64",
   "modules": [
    "QuantLib"
   ],
   "sha256": "35cd2c178aa9a30c3b7a9ca050536037c3185afd6728e6a1cf2085adef54464e",
   "bytes": 20376095,
   "parts": [
    {
     "path": "third_party/wheels/quantlib-1.43-cp39-abi3-manylinux_2_24_x86_64.manylinux_2_28_x86_64.whl",
     "sha256": "35cd2c178aa9a30c3b7a9ca050536037c3185afd6728e6a1cf2085adef54464e",
     "bytes": 20376095
    }
   ],
   "origin": {
    "kind": "pypi",
    "url": "https://files.pythonhosted.org/packages/2e/39/2df89a3f4fe6668535d7c56f29ee646f7642e46b7fc6a9db1707804c7520/quantlib-1.43-cp39-abi3-manylinux_2_24_x86_64.manylinux_2_28_x86_64.whl"
   },
   "provenance": {
    "path": "third_party/provenance/quantlib.json",
    "sha256": "fdb6d9bb95a3b6497ccd5d3ce8e751dfe21c076698bfec4f8407203706f9106e"
   },
   "notice": {
    "path": "third_party/notices/quantlib/LICENSE.TXT",
    "sha256": "6d900f97da09ba2a5907253c615d2d0ff48d5bc4e287f1b0ca57f057f7fdfb89"
   },
   "notice_member": "quantlib-1.43.data/data/share/doc/quantlib/LICENSE.TXT",
   "host_members": [
    {
     "member": "QuantLib/_QuantLib.abi3.so",
     "bytes": 38682729,
     "sha256": "a2a50e566b2cd6706085c4bb7da15f73419da1f4dd2d9359c51bd91d95aca889"
    },
    {
     "member": "quantlib.libs/libQuantLib-4575fab8.so.0.0.0",
     "bytes": 41628617,
     "sha256": "5abeaac950562bf6fae354aa55ec473f9c5c874e7db1d781a7d297206d0578b8"
    }
   ],
   "license": {
    "tags": [
     "BSD-3-Clause",
     "BSL-1.0"
    ],
    "owner": "MarketData-App legal team (license review); option example maintainers (technical)",
    "review_status": "PENDING"
   }
  },
  {
   "name": "scipy",
   "version": "1.16.2",
   "filename": "scipy-1.16.2-cp313-cp313-manylinux2014_x86_64.manylinux_2_17_x86_64.whl",
   "tag": "cp313-cp313-manylinux2014_x86_64.manylinux_2_17_x86_64",
   "modules": [
    "scipy"
   ],
   "sha256": "c2275ff105e508942f99d4e3bc56b6ef5e4b3c0af970386ca56b777608ce95b7",
   "bytes": 35681881,
   "parts": [
    {
     "path": "third_party/wheels/scipy-1.16.2-cp313-cp313-manylinux2014_x86_64.manylinux_2_17_x86_64.whl.part-00",
     "sha256": "35127965997c1d16b78ce786cdbb279a035695ba9af4dd98784d2ae083f70e12",
     "bytes": 33554432
    },
    {
     "path": "third_party/wheels/scipy-1.16.2-cp313-cp313-manylinux2014_x86_64.manylinux_2_17_x86_64.whl.part-01",
     "sha256": "ebfd95f456656b81fc738447a6225e34ff42f90acaf9f2023d63e573f6ed4aa1",
     "bytes": 2127449
    }
   ],
   "origin": {
    "kind": "pypi",
    "url": "https://files.pythonhosted.org/packages/da/6a/1a927b14ddc7714111ea51f4e568203b2bb6ed59bdd036d62127c1a360c8/scipy-1.16.2-cp313-cp313-manylinux2014_x86_64.manylinux_2_17_x86_64.whl"
   },
   "provenance": {
    "path": "third_party/provenance/scipy.json",
    "sha256": "7c6063c8e5c32e23ae03a9d6a63e0e0ed493d2e66e2b432fc9bd3e7c705a29f4"
   },
   "notice": {
    "path": "third_party/notices/scipy/LICENSE.txt",
    "sha256": "4daf14e37432e7026165979ecb7a39930707a3e89bef4876cfaf9dad36ed364a",
    "bytes": 46838
   },
   "files": [
    {
     "path": "third_party/notices/scipy/ARPACK-COPYING",
     "sha256": "0926566f9f406178d1214f8cc796e166b1213dd7c05e0c5b461a8b8ac9e50bbe",
     "bytes": 1892
    },
    {
     "path": "third_party/notices/scipy/COPYING_QHULL.txt",
     "sha256": "106d55c931fd6a84822e5345d900273d059f1c27310d02567ccb313c5d18c55d",
     "bytes": 1720
    },
    {
     "path": "third_party/notices/scipy/LGPL-2.1.txt",
     "sha256": "5749785c8bdefafcb5d798270ed0a967036fe2ca63dcedade1627565dfef81d2",
     "bytes": 26001
    },
    {
     "path": "third_party/notices/scipy/pocketfft-LICENSE.md",
     "sha256": "c254b2b5fd30ae3c89d36ba061730563b9760fca04f1b746a1b2c3157da2c789",
     "bytes": 1498
    },
    {
     "path": "third_party/notices/scipy/uarray-LICENSE",
     "sha256": "c80c39b5fce06ba4897e14e0b0a88b54458334d951eb1361402ffad2cfb863b4",
     "bytes": 1514
    }
   ],
   "license": {
    "tags": [
     "BSD-3-Clause",
     "GPL-3.0-or-later WITH GCC-exception-3.1",
     "LGPL-2.1-or-later",
     "MIT",
     "BSL-1.0"
    ],
    "owner": "MarketData-App legal team (license review); option example maintainers (technical)",
    "review_status": "PENDING"
   }
  },
  {
   "name": "mpmath",
   "version": "1.3.0",
   "filename": "mpmath-1.3.0-py3-none-any.whl",
   "tag": "py3-none-any",
   "modules": [
    "mpmath"
   ],
   "sha256": "a0b2b9fe80bbcd81a6647ff13108738cfb482d481d826cc0e02f5b35e5c88d2c",
   "bytes": 536198,
   "parts": [
    {
     "path": "third_party/wheels/mpmath-1.3.0-py3-none-any.whl",
     "sha256": "a0b2b9fe80bbcd81a6647ff13108738cfb482d481d826cc0e02f5b35e5c88d2c",
     "bytes": 536198
    }
   ],
   "origin": {
    "kind": "pypi",
    "url": "https://files.pythonhosted.org/packages/43/e3/7d92a15f894aa0c9c4b49b8ee9ac9850d6e63b03c9c32c0367a13ae62209/mpmath-1.3.0-py3-none-any.whl"
   },
   "provenance": {
    "path": "third_party/provenance/mpmath.json",
    "sha256": "00146c14b6bdb9cc7b54268c39890a60f499f3ad1c09be785df4cd4583e41235"
   },
   "notice": {
    "path": "third_party/notices/mpmath/LICENSE",
    "sha256": "c26cae81da4508e5e249985777a33821f183223ebb74d7f8cfbf90fe7eef2fb7"
   },
   "license": {
    "tags": [
     "BSD-3-Clause"
    ],
    "owner": "MarketData-App legal team (license review); option example maintainers (technical)",
    "review_status": "PENDING"
   }
  }
 ],
 "sources": [
  {
   "name": "QuantLib-source",
   "version": "1.43",
   "filename": "QuantLib-1.43.tar.gz",
   "sha256": "b41206ccc4ba39b5e86bdc940d51138222b352f79d2c6fc68649f9c9bbe58701",
   "bytes": 9520978,
   "parts": [
    {
     "path": "third_party/sources/QuantLib-1.43.tar.gz",
     "sha256": "b41206ccc4ba39b5e86bdc940d51138222b352f79d2c6fc68649f9c9bbe58701",
     "bytes": 9520978
    }
   ],
   "origin": {
    "kind": "upstream-archive",
    "url": "https://github.com/lballabio/QuantLib/releases/download/v1.43/QuantLib-1.43.tar.gz"
   },
   "provenance": {
    "path": "third_party/provenance/quantlib-source.json",
    "sha256": "76ed5edf979b6825a42b68c51c33e4b57a9b695d89dfb9bf24c489db84aeaf9f"
   },
   "notice": {
    "path": "third_party/notices/QuantLib-source/LICENSE.TXT",
    "sha256": "85c8dd19077a479f7591a7dcc25194cd58c6f5d98690d2f865d0fe870b9d0eb2"
   },
   "files": [
    {
     "path": "third_party/notices/QuantLib-source/MINPACK-NOTICE.txt",
     "sha256": "0578ed9ab718d1026177fb2627c27c6e395dd487e34d8bedf663219b9aa1f094",
     "bytes": 2343
    }
   ],
   "license": {
    "tags": [
     "BSD-3-Clause"
    ],
    "owner": "MarketData-App legal team (license review); option example maintainers (technical)",
    "review_status": "APPROVED"
   }
  }
 ],
 "retained": [
  {
   "name": "Boost",
   "version": "1.90.0",
   "files": [
    {
     "path": "third_party/sources/boost-1.90.0/LICENSE_1_0.txt",
     "sha256": "c9bff75738922193e67fa726fa225535870d2aa1059f91452c411736284ad566",
     "bytes": 1338
    },
    {
     "path": "third_party/sources/boost-1.90.0/boost/math/constants/constants.hpp",
     "sha256": "20103a024e17fdf199bcdebda721c0686e00ec5e2191f7965a4b7afbb0a43c6a",
     "bytes": 27581
    },
    {
     "path": "third_party/sources/boost-1.90.0/boost/math/policies/error_handling.hpp",
     "sha256": "5e814d688c6450caa45e4e18934dd9e713d49204800be7829b8f9d5091096e03",
     "bytes": 40434
    },
    {
     "path": "third_party/sources/boost-1.90.0/boost/math/policies/policy.hpp",
     "sha256": "0f0006710174f5bd9bacb6bdd860cf512282124f19c621877741822c9c135375",
     "bytes": 42405
    },
    {
     "path": "third_party/sources/boost-1.90.0/boost/math/quadrature/detail/tanh_sinh_detail.hpp",
     "sha256": "a50d3c2f3ece219885eb998951428d3afabe1326ae7d52057297b877d858f3e4",
     "bytes": 289177
    },
    {
     "path": "third_party/sources/boost-1.90.0/boost/math/quadrature/tanh_sinh.hpp",
     "sha256": "d2a3d463c412b3a06b1aa136bfe2137d7420a6b32a30d8ee83574df31c358869",
     "bytes": 11760
    },
    {
     "path": "third_party/sources/boost-1.90.0/boost/math/special_functions/next.hpp",
     "sha256": "2b784dfb30b490f43ac08b12cd6b1eb00c19e487211dd89909e6bd0d5eada207",
     "bytes": 30828
    },
    {
     "path": "third_party/sources/boost-1.90.0/boost/math/tools/precision.hpp",
     "sha256": "c7b2319376b3c8abf10e93eaf7f96be5d9e603ab5e4be05ea6c9bd57c824d353",
     "bytes": 16219
    }
   ],
   "origin": {
    "kind": "upstream-archive",
    "url": "https://archives.boost.io/release/1.90.0/source/boost_1_90_0.tar.bz2"
   },
   "provenance": {
    "path": "third_party/provenance/boost-source.json",
    "sha256": "f08958b5ed6223671ff3d642059ccf06608a939c831691d71f31874b074ae382"
   },
   "notice": {
    "path": "third_party/notices/Boost/LICENSE_1_0.txt",
    "sha256": "c9bff75738922193e67fa726fa225535870d2aa1059f91452c411736284ad566"
   },
   "license": {
    "tags": [
     "BSL-1.0"
    ],
    "owner": "MarketData-App legal team (license review); option example maintainers (technical)",
    "review_status": "PENDING"
   }
  }
 ]
}
